arguments: ./output/tshark_demo_main
Current dir: /root/project/learn_from_xuanyuan/day2/tshark_demo
File verbosity level: 9
date       time         ( uptime  ) [ thread name/id ]                   file:line     v| 
2025-02-19 01:27:10.747 (   0.000s) [main thread     ]             loguru.cpp:841   INFO| Logging to 'logs/log_20250219012710.txt', mode: 'w', verbosity: 9
2025-02-19 01:27:11.107 (   0.361s) [main thread     ]               main.cpp:49    INFO|     1 0.000000000 120.229.80.250 → 172.27.205.146 TCP 60 1338 → 22 [ACK] Seq=1 Ack=1 Win=1023 Len=0
    2 0.016495506 120.229.80.250 → 172.27.205.146 SSH 162 Client: Encrypted packet (len=108)
    3 0.018319318 172.27.205.146 → 120.229.80.250 SSH 154 Server: Encrypted packet (len=100)
    4 0.053402363 172.27.205.146 → 120.229.80.250 SSH 250 Server: Encrypted packet (len=196)
    5 0.061508906 120.229.80.250 → 172.27.205.146 TCP 60 1338 → 22 [ACK] Seq=109 Ack=297 Win=1022 Len=0
    6 0.062740113 120.229.80.250 → 172.27.205.146 SSH 170 Client: Encrypted packet (len=116)
    7 0.066449283 172.27.205.146 → 120.229.80.250 SSH 154 Server: Encrypted packet (len=100)
    8 0.107048499 172.27.205.146 → 120.229.80.250 SSH 618 Server: Encrypted packet (len=564)
    9 0.115249662 120.229.80.250 → 172.27.205.146 TCP 60 1338 → 22 [ACK] Seq=225 Ack=961 Win=1025 Len=0
   10 0.116005471 120.229.80.250 → 172.27.205.146 SSH 170 Client: Encrypted packet (len=116)
   11 0.116238474 120.229.80.250 → 172.27.205.146 SSH 154 Client: Encrypted packet (len=100)
   12 0.116293656 172.27.205.146 → 120.229.80.250 TCP 54 22 → 1338 [ACK] Seq=961 Ack=441 Win=5246 Len=0
   13 0.420652799 172.27.205.146 → 100.100.30.25 TCP 988 46052 → 80 [PSH, ACK] Seq=1 Ack=1 Win=501 Len=934
   14 0.450765999 100.100.30.25 → 172.27.205.146 TCP 60 80 → 46052 [ACK] Seq=1 Ack=935 Win=5938 Len=0
   15 0.569506060 120.229.80.250 → 172.27.205.146 SSH 146 Client: Encrypted packet (len=92)
   16 0.571611701 172.27.205.146 → 120.229.80.250 SSH 178 Server: Encrypted packet (len=124)
   17 0.580507845 120.229.80.250 → 172.27.205.146 SSH 146 Client: Encrypted packet (len=92)
   18 0.580610492 172.27.205.146 → 120.229.80.250 SSH 186 Server: Encrypted packet (len=132)
   19 0.589511335 120.229.80.250 → 172.27.205.146 SSH 154 Client: Encrypted packet (len=100)
   20 0.589637641 172.27.205.146 → 120.229.80.250 SSH 218 Server: Encrypted packet (len=164)
   21 0.599508364 120.229.80.250 → 172.27.205.146 SSH 162 Client: Encrypted packet (len=108)
   22 0.601571738 172.27.205.146 → 120.229.80.250 SSH 186 Server: Encrypted packet (len=132)
   23 0.610393131 120.229.80.250 → 172.27.205.146 SSH 162 Client: Encrypted packet (len=108)
   24 0.612592477 172.27.205.146 → 120.229.80.250 SSH 178 Server: Encrypted packet (len=124)
   25 0.622136765 120.229.80.250 → 172.27.205.146 SSH 178 Client: Encrypted packet (len=124)
   26 0.624066808 172.27.205.146 → 120.229.80.250 SSH 210 Server: Encrypted packet (len=156)
   27 0.633135148 120.229.80.250 → 172.27.205.146 SSH 178 Client: Encrypted packet (len=124)
   28 0.635268218 172.27.205.146 → 120.229.80.250 SSH 210 Server: Encrypted packet (len=156)
   29 0.651891990 120.229.80.250 → 172.27.205.146 SSH 258 Client: Encrypted packet (len=204)
   30 0.654013621 172.27.205.146 → 120.229.80.250 SSH 242 Server: Encrypted packet (len=188)
   31 0.701961907 172.27.205.146 → 120.229.80.250 SSH 186 Server: Encrypted packet (len=132)
   32 0.706168571 120.229.80.250 → 172.27.205.146 TCP 60 1338 → 22 [ACK] Seq=1393 Ack=2137 Win=1021 Len=0
   33 0.729186579 172.27.205.146 → 120.229.80.250 SSH 162 Server: Encrypted packet (len=108)
   34 0.737380293 120.229.80.250 → 172.27.205.146 TCP 60 1338 → 22 [ACK] Seq=1393 Ack=2377 Win=1025 Len=0
   35 0.789757601 120.229.80.250 → 172.27.205.146 SSH 162 Client: Encrypted packet (len=108)
   36 0.791602743 172.27.205.146 → 120.229.80.250 SSH 154 Server: Encrypted packet (len=100)
   37 0.798285324 172.27.205.146 → 120.229.80.250 SSH 146 Server: Encrypted packet (len=92)
   38 0.802162433 172.27.205.146 → 100.100.30.25 TCP 1016 46052 → 80 [PSH, ACK] Seq=935 Ack=1 Win=501 Len=962
   39 0.806377959 120.229.80.250 → 172.27.205.146 TCP 60 1338 → 22 [ACK] Seq=1501 Ack=2569 Win=1025 Len=0
   40 0.807254614 120.229.80.250 → 172.27.205.146 SSH 154 Client: Encrypted packet (len=100)
   41 0.809822998 172.27.205.146 → 120.229.80.250 SSH 154 Server: Encrypted packet (len=100)
   42 0.832268650 100.100.30.25 → 172.27.205.146 TCP 60 80 → 46052 [ACK] Seq=1 Ack=1897 Win=5961 Len=0
   43 0.859255038 120.229.80.250 → 172.27.205.146 TCP 60 1338 → 22 [ACK] Seq=1601 Ack=2669 Win=1024 Len=0
   44 0.861306905 172.27.205.146 → 120.229.80.250 SSH 146 Server: Encrypted packet (len=92)
   45 0.920506760 120.229.80.250 → 172.27.205.146 TCP 60 1338 → 22 [ACK] Seq=1601 Ack=2761 Win=1024 Len=0
   46 1.110746134 172.27.205.146 → 120.229.80.250 SSH 146 Server: Encrypted packet (len=92)
   47 1.120016734 120.229.80.250 → 172.27.205.146 SSH 146 Client: Encrypted packet (len=92)
   48 1.122161900 172.27.205.146 → 120.229.80.250 SSH 154 Server: Encrypted packet (len=100)
   49 1.163213412 172.27.205.146 → 120.229.80.250 SSH 162 Server: Encrypted packet (len=108)
   50 1.165693931 172.27.205.146 → 120.229.80.250 SSH 162 Server: Encrypted packet (len=108)
   51 1.171390857 120.229.80.250 → 172.27.205.146 TCP 60 1338 → 22 [ACK] Seq=1693 Ack=3061 Win=1023 Len=0
   52 1.172007704 120.229.80.250 → 172.27.205.146 SSH 170 Client: Encrypted packet (len=116)
   53 1.174646024 120.229.80.250 → 172.27.205.146 SSH 170 Client: Encrypted packet (len=116)
   54 1.174679648 172.27.205.146 → 120.229.80.250 TCP 54 22 → 1338 [ACK] Seq=3169 Ack=1925 Win=5246 Len=0
   55 1.203801357 172.27.205.146 → 100.100.30.25 TCP 1048 46052 → 80 [PSH, ACK] Seq=1897 Ack=1 Win=501 Len=994
   56 1.233925577 100.100.30.25 → 172.27.205.146 TCP 60 80 → 46052 [ACK] Seq=1 Ack=2891 Win=5983 Len=0
   57 1.240512374 172.27.205.146 → 120.229.80.250 SSH 146 Server: Encrypted packet (len=92)
   58 1.289133755 120.229.80.250 → 172.27.205.146 TCP 60 1338 → 22 [ACK] Seq=1925 Ack=3261 Win=1022 Len=0
   59 1.305269963 120.229.80.250 → 172.27.205.146 SSH 146 Client: Encrypted packet (len=92)
   60 1.307006684 172.27.205.146 → 120.229.80.250 SSH 154 Server: Encrypted packet (len=100)
   61 1.360880212 172.27.205.146 → 120.229.80.250 SSH 146 Server: Encrypted packet (len=92)
   62 1.367766403 120.229.80.250 → 172.27.205.146 TCP 60 1338 → 22 [ACK] Seq=2017 Ack=3361 Win=1022 Len=0
   63 1.370256623 120.229.80.250 → 172.27.205.146 SSH 146 Client: Encrypted packet (len=92)
   64 1.372403409 172.27.205.146 → 120.229.80.250 SSH 154 Server: Encrypted packet (len=100)
   65 1.429248663 120.229.80.250 → 172.27.205.146 TCP 60 1338 → 22 [ACK] Seq=2109 Ack=3553 Win=1021 Len=0
   66 1.585212515 172.27.205.146 → 100.100.30.25 TCP 1048 46052 → 80 [PSH, ACK] Seq=2891 Ack=1 Win=501 Len=994
   67 1.615318285 100.100.30.25 → 172.27.205.146 TCP 60 80 → 46052 [ACK] Seq=1 Ack=3885 Win=5998 Len=0
   68 1.701750143 193.41.206.156 → 172.27.205.146 TCP 60 58914 → 8728 [SYN] Seq=0 Win=65535 Len=0
   69 1.701765983 172.27.205.146 → 193.41.206.156 TCP 54 8728 → 58914 [RST, ACK] Seq=1 Ack=1 Win=0 Len=0
   70 1.752508991 172.27.205.146 → 120.229.80.250 SSH 146 Server: Encrypted packet (len=92)
   71 1.814774695 120.229.80.250 → 172.27.205.146 TCP 60 1338 → 22 [ACK] Seq=2109 Ack=3645 Win=1020 Len=0
   72 1.815257230 120.229.80.250 → 172.27.205.146 SSH 154 Client: Encrypted packet (len=100)
   73 1.817035722 172.27.205.146 → 120.229.80.250 SSH 154 Server: Encrypted packet (len=100)
   74 1.872788320 172.27.205.146 → 120.229.80.250 SSH 146 Server: Encrypted packet (len=92)
   75 1.876635435 120.229.80.250 → 172.27.205.146 TCP 60 1338 → 22 [ACK] Seq=2209 Ack=3745 Win=1020 Len=0
   76 1.881773140 120.229.80.250 → 172.27.205.146 SSH 146 Client: Encrypted packet (len=92)
   77 1.884062453 172.27.205.146 → 120.229.80.250 SSH 154 Server: Encrypted packet (len=100)
   78 1.936894429 120.229.80.250 → 172.27.205.146 TCP 60 1338 → 22 [ACK] Seq=2301 Ack=3937 Win=1025 Len=0
   79 1.962973212 172.27.205.146 → 123.57.137.105 TCP 54 58364 → 443 [ACK] Seq=1 Ack=1 Win=501 Len=0
   80 1.986727880 172.27.205.146 → 100.100.30.25 TCP 1048 46052 → 80 [PSH, ACK] Seq=3885 Ack=1 Win=501 Len=994
   81 2.004396606 123.57.137.105 → 172.27.205.146 TCP 60 [TCP ACKed unseen segment] 443 → 58364 [ACK] Seq=1 Ack=2 Win=83 Len=0
   82 2.016843735 100.100.30.25 → 172.27.205.146 TCP 60 80 → 46052 [ACK] Seq=1 Ack=4879 Win=6014 Len=0
   83 2.027012971 172.27.205.146 → 100.100.30.25 TCP 2902 46052 → 80 [ACK] Seq=4879 Ack=1 Win=501 Len=2848
   84 2.027021303 172.27.205.146 → 100.100.30.25 TCP 496 46052 → 80 [PSH, ACK] Seq=7727 Ack=1 Win=501 Len=442 [TCP segment of a reassembled PDU]
   85 2.057147580 100.100.30.25 → 172.27.205.146 TCP 60 80 → 46052 [ACK] Seq=1 Ack=6303 Win=6036 Len=0
   86 2.057165809 100.100.30.25 → 172.27.205.146 TCP 60 80 → 46052 [ACK] Seq=1 Ack=7727 Win=6058 Len=0
   87 2.057167539 100.100.30.25 → 172.27.205.146 TCP 60 80 → 46052 [ACK] Seq=1 Ack=8169 Win=6058 Len=0
   88 2.264479678 172.27.205.146 → 120.229.80.250 SSH 146 Server: Encrypted packet (len=92)
   89 2.321154609 120.229.80.250 → 172.27.205.146 TCP 60 1338 → 22 [ACK] Seq=2301 Ack=4029 Win=1025 Len=0
   90 2.337520850 120.229.80.250 → 172.27.205.146 SSH 154 Client: Encrypted packet (len=100)
   91 2.339345144 172.27.205.146 → 120.229.80.250 SSH 154 Server: Encrypted packet (len=100)
   92 2.384883900 172.27.205.146 → 120.229.80.250 SSH 146 Server: Encrypted packet (len=92)
   93 2.388378276 172.27.205.146 → 100.100.30.25 TCP 1048 46052 → 80 [PSH, ACK] Seq=8169 Ack=1 Win=501 Len=994 [TCP segment of a reassembled PDU]
   94 2.393032153 120.229.80.250 → 172.27.205.146 TCP 60 1338 → 22 [ACK] Seq=2401 Ack=4221 Win=1024 Len=0
   95 2.394006026 120.229.80.250 → 172.27.205.146 SSH 146 Client: Encrypted packet (len=92)
   96 2.395482521 172.27.205.146 → 120.229.80.250 SSH 154 Server: Encrypted packet (len=100)
   97 2.418547580 100.100.30.25 → 172.27.205.146 TCP 60 80 → 46052 [ACK] Seq=1 Ack=9163 Win=6081 Len=0
   98 2.444648956 120.229.80.250 → 172.27.205.146 TCP 60 1338 → 22 [ACK] Seq=2493 Ack=4321 Win=1024 Len=0
   99 2.647605126 172.27.205.146 → 120.229.80.250 SSH 146 Server: Encrypted packet (len=92)
  100 2.648992279 177.44.137.90 → 172.27.205.146 TCP 60 20195 → 23 [SYN] Seq=0 Win=259 Len=0
  101 2.649002159 172.27.205.146 → 177.44.137.90 TCP 54 23 → 20195 [RST, ACK] Seq=1 Ack=1 Win=0 Len=0
  102 2.657028186 120.229.80.250 → 172.27.205.146 SSH 146 Client: Encrypted packet (len=92)
  103 2.659350128 172.27.205.146 → 120.229.80.250 SSH 154 Server: Encrypted packet (len=100)
  104 2.721160356 120.229.80.250 → 172.27.205.146 TCP 60 1338 → 22 [ACK] Seq=2585 Ack=4513 Win=1023 Len=0
  105 2.776951891 172.27.205.146 → 120.229.80.250 SSH 146 Server: Encrypted packet (len=92)
  106 2.828283151 120.229.80.250 → 172.27.205.146 TCP 60 1338 → 22 [ACK] Seq=2585 Ack=4605 Win=1022 Len=0
  107 2.844154263 120.229.80.250 → 172.27.205.146 SSH 154 Client: Encrypted packet (len=100)
  108 2.845889327 172.27.205.146 → 120.229.80.250 SSH 154 Server: Encrypted packet (len=100)
  109 2.850125373 172.27.205.146 → 100.100.30.25 TCP 960 46052 → 80 [PSH, ACK] Seq=9163 Ack=1 Win=501 Len=906 [TCP segment of a reassembled PDU]
  110 2.880222174 100.100.30.25 → 172.27.205.146 TCP 60 80 → 46052 [ACK] Seq=1 Ack=10069 Win=6103 Len=0
  111 2.897387438 172.27.205.146 → 120.229.80.250 SSH 146 Server: Encrypted packet (len=92)
  112 2.904522984 120.229.80.250 → 172.27.205.146 TCP 60 1338 → 22 [ACK] Seq=2685 Ack=4705 Win=1022 Len=0
  113 2.906522731 120.229.80.250 → 172.27.205.146 SSH 146 Client: Encrypted packet (len=92)
  114 2.908707236 172.27.205.146 → 120.229.80.250 SSH 154 Server: Encrypted packet (len=100)
  115 2.966543616 120.229.80.250 → 172.27.205.146 TCP 60 1338 → 22 [ACK] Seq=2777 Ack=4897 Win=1021 Len=0
  116 3.070815241 172.27.205.146 → 120.229.80.250 SSH 162 Server: Encrypted packet (len=108)
  117 3.080142695 120.229.80.250 → 172.27.205.146 SSH 154 Client: Encrypted packet (len=100)
  118 3.122986443 172.27.205.146 → 120.229.80.250 TCP 54 22 → 1338 [ACK] Seq=5005 Ack=2877 Win=5246 Len=0
  119 3.288515386 172.27.205.146 → 120.229.80.250 SSH 162 Server: Encrypted packet (len=108)
  120 3.348912414 120.229.80.250 → 172.27.205.146 TCP 60 1338 → 22 [ACK] Seq=2877 Ack=5113 Win=1020 Len=0
  121 3.349519736 120.229.80.250 → 172.27.205.146 SSH 154 Client: Encrypted packet (len=100)
  122 3.349523529 172.27.205.146 → 120.229.80.250 TCP 54 22 → 1338 [ACK] Seq=5113 Ack=2977 Win=5246 Len=0
  123 3.351273095 172.27.205.146 → 120.229.80.250 SSH 154 Server: Encrypted packet (len=100)
  124 3.408723827 172.27.205.146 → 120.229.80.250 SSH 146 Server: Encrypted packet (len=92)
  125 3.410908463 120.229.80.250 → 172.27.205.146 TCP 60 1338 → 22 [ACK] Seq=2977 Ack=5213 Win=1020 Len=0
  126 3.417777891 120.229.80.250 → 172.27.205.146 SSH 146 Client: Encrypted packet (len=92)
  127 3.419890874 172.27.205.146 → 120.229.80.250 SSH 154 Server: Encrypted packet (len=100)
  128 3.472165864 120.229.80.250 → 172.27.205.146 TCP 60 1338 → 22 [ACK] Seq=3069 Ack=5405 Win=1025 Len=0
  129 3.595895254 172.27.205.146 → 120.229.80.250 SSH 202 Server: Encrypted packet (len=148)
  130 3.605418991 120.229.80.250 → 172.27.205.146 SSH 170 Client: Encrypted packet (len=116)
  131 3.646983036 172.27.205.146 → 120.229.80.250 TCP 54 22 → 1338 [ACK] Seq=5553 Ack=3185 Win=5246 Len=0
  132 3.800477162 172.27.205.146 → 120.229.80.250 SSH 146 Server: Encrypted packet (len=92)
  133 3.855538716 120.229.80.250 → 172.27.205.146 TCP 60 1338 → 22 [ACK] Seq=3185 Ack=5645 Win=1024 Len=0
  134 3.871540369 120.229.80.250 → 172.27.205.146 SSH 146 Client: Encrypted packet (len=92)
  135 3.871549374 172.27.205.146 → 120.229.80.250 TCP 54 22 → 1338 [ACK] Seq=5645 Ack=3277 Win=5246 Len=0
  136 3.873315785 172.27.205.146 → 120.229.80.250 SSH 154 Server: Encrypted packet (len=100)
  137 3.920793408 172.27.205.146 → 120.229.80.250 SSH 146 Server: Encrypted packet (len=92)
  138 3.928967452 120.229.80.250 → 172.27.205.146 TCP 60 1338 → 22 [ACK] Seq=3277 Ack=5837 Win=1023 Len=0
  139 3.930551135 120.229.80.250 → 172.27.205.146 SSH 146 Client: Encrypted packet (len=92)
  140 3.932869759 172.27.205.146 → 120.229.80.250 SSH 154 Server: Encrypted packet (len=100)
  141 3.993660082 120.229.80.250 → 172.27.205.146 TCP 60 1338 → 22 [ACK] Seq=3369 Ack=5937 Win=1023 Len=0
  142 4.032297701 172.27.205.146 → 120.229.80.250 SSH 146 Server: Encrypted packet (len=92)
  143 4.044910410 120.229.80.250 → 172.27.205.146 SSH 186 Client: Encrypted packet (len=132)
  144 4.086979090 172.27.205.146 → 120.229.80.250 TCP 54 22 → 1338 [ACK] Seq=6029 Ack=3501 Win=5246 Len=0
  145 4.312549804 172.27.205.146 → 120.229.80.250 SSH 146 Server: Encrypted packet (len=92)
  146 4.362167098 120.229.80.250 → 172.27.205.146 TCP 60 1338 → 22 [ACK] Seq=3501 Ack=6121 Win=1022 Len=0
  147 4.378295302 120.229.80.250 → 172.27.205.146 SSH 146 Client: Encrypted packet (len=92)
  148 4.378303755 172.27.205.146 → 120.229.80.250 TCP 54 22 → 1338 [ACK] Seq=6121 Ack=3593 Win=5246 Len=0
  149 4.380066925 172.27.205.146 → 120.229.80.250 SSH 154 Server: Encrypted packet (len=100)
  150 4.432882849 172.27.205.146 → 120.229.80.250 SSH 146 Server: Encrypted packet (len=92)
  151 4.438793740 120.229.80.250 → 172.27.205.146 TCP 60 1338 → 22 [ACK] Seq=3593 Ack=6221 Win=1022 Len=0
  152 4.442040283 120.229.80.250 → 172.27.205.146 SSH 146 Client: Encrypted packet (len=92)
  153 4.444177699 172.27.205.146 → 120.229.80.250 SSH 162 Server: Encrypted packet (len=108)
  154 4.499428918 120.229.80.250 → 172.27.205.146 TCP 60 1338 → 22 [ACK] Seq=3685 Ack=6421 Win=1021 Len=0
  155 4.824665067 172.27.205.146 → 120.229.80.250 SSH 146 Server: Encrypted packet (len=92)
  156 4.886809394 120.229.80.250 → 172.27.205.146 TCP 60 1338 → 22 [ACK] Seq=3685 Ack=6513 Win=1021 Len=0
  157 4.887550533 120.229.80.250 → 172.27.205.146 SSH 154 Client: Encrypted packet (len=100)
  158 4.889339978 172.27.205.146 → 120.229.80.250 SSH 154 Server: Encrypted packet (len=100)
  159 4.896038395 ee:ff:ff:ff:ff:ff → Xensourc_1a:37:de ARP 42 Who has 172.27.205.146? Tell 172.27.207.253
  160 4.896046984 Xensourc_1a:37:de → ee:ff:ff:ff:ff:ff ARP 42 172.27.205.146 is at 00:16:3e:1a:37:de
  161 4.944966796 172.27.205.146 → 120.229.80.250 SSH 146 Server: Encrypted packet (len=92)
  162 4.947058221 120.229.80.250 → 172.27.205.146 TCP 60 1338 → 22 [ACK] Seq=3785 Ack=6613 Win=1020 Len=0
  163 4.954056625 120.229.80.250 → 172.27.205.146 SSH 146 Client: Encrypted packet (len=92)
  164 4.956266626 172.27.205.146 → 120.229.80.250 SSH 154 Server: Encrypted packet (len=100)
  165 5.008920891 120.229.80.250 → 172.27.205.146 TCP 60 1338 → 22 [ACK] Seq=3877 Ack=6805 Win=1025 Len=0
  166 5.128409292 172.27.205.146 → 100.100.2.136 DNS 92 Standard query 0xe3f8 A mobile.events.data.microsoft.com
  167 5.128955636 100.100.2.136 → 172.27.205.146 DNS 215 Standard query response 0xe3f8 A mobile.events.data.microsoft.com CNAME mobile.events.data.trafficmanager.net CNAME onedscolprdwus17.westus.cloudapp.azure.com A 20.189.173.16
  168 5.129396339 172.27.205.146 → 100.100.2.136 DNS 102 Standard query 0xb2cc AAAA onedscolprdwus17.westus.cloudapp.azure.com
  169 5.179672108 100.100.2.136 → 172.27.205.146 DNS 178 Standard query response 0xb2cc AAAA onedscolprdwus17.westus.cloudapp.azure.com SOA ns1-02.azure-dns.com
  170 5.179985356 172.27.205.146 → 20.189.173.16 TCP 74 60266 → 443 [SYN] Seq=0 Win=64240 Len=0 MSS=1460 SACK_PERM=1 TSval=1393604104 TSecr=0 WS=128
  171 5.336542348 172.27.205.146 → 120.229.80.250 SSH 146 Server: Encrypted packet (len=92)
  172 5.344951483 20.189.173.16 → 172.27.205.146 TCP 74 443 → 60266 [SYN, ACK] Seq=0 Ack=1 Win=65535 Len=0 MSS=1440 WS=256 SACK_PERM=1 TSval=1608723958 TSecr=1393604104
  173 5.344967002 172.27.205.146 → 20.189.173.16 TCP 66 60266 → 443 [ACK] Seq=1 Ack=1 Win=64256 Len=0 TSval=1393604269 TSecr=1608723958
  174 5.345349598 172.27.205.146 → 20.189.173.16 TLSv1 551 Client Hello
  175 5.391309791 120.229.80.250 → 172.27.205.146 TCP 60 1338 → 22 [ACK] Seq=3877 Ack=6897 Win=1025 Len=0
  176 5.407176489 120.229.80.250 → 172.27.205.146 SSH 154 Client: Encrypted packet (len=100)
  177 5.408891008 172.27.205.146 → 120.229.80.250 SSH 162 Server: Encrypted packet (len=108)
  178 5.456833237 172.27.205.146 → 120.229.80.250 SSH 146 Server: Encrypted packet (len=92)
  179 5.464924407 120.229.80.250 → 172.27.205.146 TCP 60 1338 → 22 [ACK] Seq=3977 Ack=7097 Win=1024 Len=0
  180 5.466047288 120.229.80.250 → 172.27.205.146 SSH 146 Client: Encrypted packet (len=92)
  181 5.468132019 172.27.205.146 → 120.229.80.250 SSH 154 Server: Encrypted packet (len=100)
  182 5.531183157 120.229.80.250 → 172.27.205.146 TCP 60 1338 → 22 [ACK] Seq=4069 Ack=7197 Win=1024 Len=0
  183 5.592445559 20.189.173.16 → 172.27.205.146 TLSv1.3 165 Hello Retry Request, Change Cipher Spec
  184 5.592465214 172.27.205.146 → 20.189.173.16 TCP 66 60266 → 443 [ACK] Seq=486 Ack=100 Win=64256 Len=0 TSval=1393604517 TSecr=1608724199
  185 5.593734824 172.27.205.146 → 20.189.173.16 TLSv1.3 622 Change Cipher Spec, Client Hello
  186 5.771601468 20.189.173.16 → 172.27.205.146 TLSv1.3 4598 Server Hello, Application Data
  187 5.771650323 172.27.205.146 → 20.189.173.16 TCP 66 60266 → 443 [ACK] Seq=1042 Ack=4632 Win=64128 Len=0 TSval=1393604696 TSecr=1608724385
  188 5.775878072 172.27.205.146 → 20.189.173.16 TLSv1.3 2211 Application Data, Application Data
  189 5.848425917 172.27.205.146 → 120.229.80.250 SSH 146 Server: Encrypted packet (len=92)
  190 5.860581058 172.27.205.146 → 120.229.80.250 SSH 146 Server: Encrypted packet (len=92)
  191 5.868685888 120.229.80.250 → 172.27.205.146 TCP 60 1338 → 22 [ACK] Seq=4069 Ack=7381 Win=1023 Len=0
  192 5.915185882 120.229.80.250 → 172.27.205.146 SSH 154 Client: Encrypted packet (len=100)
  193 5.916946021 172.27.205.146 → 120.229.80.250 SSH 154 Server: Encrypted packet (len=100)
  194 5.940798157 20.189.173.16 → 172.27.205.146 TCP 78 [TCP Dup ACK 186#1] 443 → 60266 [ACK] Seq=4632 Ack=1042 Win=4193792 Len=0 TSval=1608724554 TSecr=1393604696 SLE=2470 SRE=3187
  195 5.940813237 20.189.173.16 → 172.27.205.146 TCP 66 443 → 60266 [ACK] Seq=4632 Ack=3187 Win=4194816 Len=0 TSval=1608724554 TSecr=1393604700
  196 5.970128162 20.189.173.16 → 172.27.205.146 TLSv1.3 169 Application Data
  197 5.975565631 120.229.80.250 → 172.27.205.146 TCP 60 1338 → 22 [ACK] Seq=4169 Ack=7481 Win=1023 Len=0
  198 5.978603961 172.27.205.146 → 120.229.80.250 SSH 146 Server: Encrypted packet (len=92)
  199 5.987821399 120.229.80.250 → 172.27.205.146 SSH 146 Client: Encrypted packet (len=92)
  200 5.989977583 172.27.205.146 → 120.229.80.250 SSH 154 Server: Encrypted packet (len=100)
  201 6.010969700 172.27.205.146 → 20.189.173.16 TCP 66 60266 → 443 [ACK] Seq=3187 Ack=4735 Win=64128 Len=0 TSval=1393604935 TSecr=1608724583
  202 6.037681733 120.229.80.250 → 172.27.205.146 TCP 60 1338 → 22 [ACK] Seq=4261 Ack=7673 Win=1022 Len=0
  203 6.174259709 193.163.125.251 → 172.27.205.146 TCP 60 39712 → 20000 [SYN] Seq=0 Win=14600 Len=0 MSS=1460
  204 6.174278108 172.27.205.146 → 193.163.125.251 TCP 54 20000 → 39712 [RST, ACK] Seq=1 Ack=1 Win=0 Len=0
  205 6.250387030 172.27.205.146 → 120.229.80.250 SSH 146 Server: Encrypted packet (len=92)
  206 6.259571374 120.229.80.250 → 172.27.205.146 SSH 146 Client: Encrypted packet (len=92)
  207 6.261708431 172.27.205.146 → 120.229.80.250 SSH 154 Server: Encrypted packet (len=100)
  208 6.314576864 120.229.80.250 → 172.27.205.146 TCP 60 1338 → 22 [ACK] Seq=4353 Ack=7865 Win=1021 Len=0
  209 6.380572481 172.27.205.146 → 120.229.80.250 SSH 146 Server: Encrypted packet (len=92)
  210 6.436817575 120.229.80.250 → 172.27.205.146 TCP 60 1338 → 22 [ACK] Seq=4353 Ack=7957 Win=1021 Len=0
  211 6.453067076 120.229.80.250 → 172.27.205.146 SSH 154 Client: Encrypted packet (len=100)
  212 6.454948397 172.27.205.146 → 120.229.80.250 SSH 154 Server: Encrypted packet (len=100)
  213 6.500777419 172.27.205.146 → 120.229.80.250 SSH 146 Server: Encrypted packet (len=92)
  214 6.508941554 120.229.80.250 → 172.27.205.146 TCP 60 1338 → 22 [ACK] Seq=4453 Ack=8149 Win=1020 Len=0
  215 6.510064082 120.229.80.250 → 172.27.205.146 SSH 146 Client: Encrypted packet (len=92)
  216 6.512166543 172.27.205.146 → 120.229.80.250 SSH 154 Server: Encrypted packet (len=100)
  217 6.559945765 120.229.80.250 → 172.27.205.146 TCP 60 1338 → 22 [ACK] Seq=4545 Ack=8249 Win=1025 Len=0
  218 6.892477208 172.27.205.146 → 120.229.80.250 SSH 154 Server: Encrypted packet (len=100)
  219 6.943316323 120.229.80.250 → 172.27.205.146 TCP 60 1338 → 22 [ACK] Seq=4545 Ack=8349 Win=1025 Len=0
  220 6.959699639 120.229.80.250 → 172.27.205.146 SSH 154 Client: Encrypted packet (len=100)
  221 6.961498811 172.27.205.146 → 120.229.80.250 SSH 162 Server: Encrypted packet (len=108)
  222 7.012705059 172.27.205.146 → 120.229.80.250 SSH 146 Server: Encrypted packet (len=92)
  223 7.020821487 120.229.80.250 → 172.27.205.146 TCP 60 1338 → 22 [ACK] Seq=4645 Ack=8457 Win=1025 Len=0
  224 7.021946119 120.229.80.250 → 172.27.205.146 SSH 146 Client: Encrypted packet (len=92)
  225 7.024024616 172.27.205.146 → 120.229.80.250 SSH 162 Server: Encrypted packet (len=108)
  226 7.082069893 120.229.80.250 → 172.27.205.146 TCP 60 1338 → 22 [ACK] Seq=4737 Ack=8657 Win=1024 Len=0
  227 7.306481219 89.248.165.153 → 172.27.205.146 TCP 60 51865 → 13938 [SYN] Seq=0 Win=1024 Len=0
  228 7.306496527 172.27.205.146 → 89.248.165.153 TCP 54 13938 → 51865 [RST, ACK] Seq=1 Ack=1 Win=0 Len=0
  229 7.404498701 172.27.205.146 → 120.229.80.250 SSH 146 Server: Encrypted packet (len=92)
  230 7.465833153 120.229.80.250 → 172.27.205.146 TCP 60 1338 → 22 [ACK] Seq=4737 Ack=8749 Win=1023 Len=0
  231 7.466323835 120.229.80.250 → 172.27.205.146 SSH 154 Client: Encrypted packet (len=100)
  232 7.468091216 172.27.205.146 → 120.229.80.250 SSH 162 Server: Encrypted packet (len=108)
  233 7.512474849 89.248.165.153 → 172.27.205.146 TCP 60 51865 → 13938 [RST] Seq=1 Win=1200 Len=0
  234 7.524925824 172.27.205.146 → 120.229.80.250 SSH 146 Server: Encrypted packet (len=92)
  235 7.526829991 120.229.80.250 → 172.27.205.146 TCP 60 1338 → 22 [ACK] Seq=4837 Ack=8857 Win=1023 Len=0
  236 7.534080406 120.229.80.250 → 172.27.205.146 SSH 146 Client: Encrypted packet (len=92)
  237 7.536203598 172.27.205.146 → 120.229.80.250 SSH 162 Server: Encrypted packet (len=108)
  238 7.587962909 120.229.80.250 → 172.27.205.146 TCP 60 1338 → 22 [ACK] Seq=4929 Ack=9057 Win=1022 Len=0
  239 7.816238806 89.248.165.16 → 172.27.205.146 TCP 60 52966 → 63544 [SYN] Seq=0 Win=1025 Len=0 MSS=1460
  240 7.816254182 172.27.205.146 → 89.248.165.16 TCP 54 63544 → 52966 [RST, ACK] Seq=1 Ack=1 Win=0 Len=0
  241 7.916473872 172.27.205.146 → 120.229.80.250 SSH 146 Server: Encrypted packet (len=92)
  242 7.973089086 120.229.80.250 → 172.27.205.146 TCP 60 1338 → 22 [ACK] Seq=4929 Ack=9149 Win=1022 Len=0
  243 7.988592587 120.229.80.250 → 172.27.205.146 SSH 154 Client: Encrypted packet (len=100)
  244 7.989368424 172.27.205.146 → 120.229.80.250 SSH 154 Server: Encrypted packet (len=100)
  245 8.020384597 89.248.165.16 → 172.27.205.146 TCP 60 52966 → 63544 [RST] Seq=1 Win=1200 Len=0 MSS=1460
  246 8.036732754 172.27.205.146 → 120.229.80.250 SSH 146 Server: Encrypted packet (len=92)
  247 8.044955845 120.229.80.250 → 172.27.205.146 TCP 60 1338 → 22 [ACK] Seq=5029 Ack=9341 Win=1021 Len=0
  248 8.046071925 120.229.80.250 → 172.27.205.146 SSH 146 Client: Encrypted packet (len=92)
  249 8.048430543 172.27.205.146 → 120.229.80.250 SSH 154 Server: Encrypted packet (len=100)
  250 8.111460934 120.229.80.250 → 172.27.205.146 TCP 60 1338 → 22 [ACK] Seq=5121 Ack=9441 Win=1021 Len=0
  251 8.428506086 172.27.205.146 → 120.229.80.250 SSH 146 Server: Encrypted packet (len=92)
  252 8.480464332 120.229.80.250 → 172.27.205.146 TCP 60 1338 → 22 [ACK] Seq=5121 Ack=9533 Win=1020 Len=0
  253 8.495971320 120.229.80.250 → 172.27.205.146 SSH 154 Client: Encrypted packet (len=100)
  254 8.497824579 172.27.205.146 → 120.229.80.250 SSH 154 Server: Encrypted packet (len=100)
  255 8.550443775 172.27.205.146 → 120.229.80.250 SSH 146 Server: Encrypted packet (len=92)
  256 8.556346819 120.229.80.250 → 172.27.205.146 TCP 60 1338 → 22 [ACK] Seq=5221 Ack=9633 Win=1020 Len=0
  257 8.559582737 120.229.80.250 → 172.27.205.146 SSH 146 Client: Encrypted packet (len=92)
  258 8.561813752 172.27.205.146 → 120.229.80.250 SSH 154 Server: Encrypted packet (len=100)
  259 8.619091764 120.229.80.250 → 172.27.205.146 TCP 60 1338 → 22 [ACK] Seq=5313 Ack=9825 Win=1025 Len=0
  260 8.940488658 172.27.205.146 → 120.229.80.250 SSH 146 Server: Encrypted packet (len=92)
  261 8.991348269 120.229.80.250 → 172.27.205.146 TCP 60 1338 → 22 [ACK] Seq=5313 Ack=9917 Win=1025 Len=0
  262 9.007084875 120.229.80.250 → 172.27.205.146 SSH 154 Client: Encrypted packet (len=100)
  263 9.008857096 172.27.205.146 → 120.229.80.250 SSH 154 Server: Encrypted packet (len=100)
  264 9.031975852 172.27.205.146 → 120.229.80.250 SSH 138 Server: Encrypted packet (len=84)
  265 9.040097476 120.229.80.250 → 172.27.205.146 TCP 60 1338 → 22 [ACK] Seq=5413 Ack=10101 Win=1024 Len=0
  266 9.042337508 120.229.80.250 → 172.27.205.146 SSH 138 Client: Encrypted packet (len=84)
  267 9.046602208 120.229.80.250 → 172.27.205.146 SSH 138 Client: Encrypted packet (len=84)
  268 9.046652784 172.27.205.146 → 120.229.80.250 TCP 54 22 → 1338 [ACK] Seq=10101 Ack=5581 Win=5246 Len=0
  269 9.060566327 172.27.205.146 → 120.229.80.250 SSH 146 Server: Encrypted packet (len=92)
  270 9.069593659 120.229.80.250 → 172.27.205.146 SSH 146 Client: Encrypted packet (len=92)
  271 9.072436890 172.27.205.146 → 120.229.80.250 SSH 162 Server: Encrypted packet (len=108)
  272 9.130215830 120.229.80.250 → 172.27.205.146 TCP 60 1338 → 22 [ACK] Seq=5673 Ack=10301 Win=1023 Len=0
  273 9.452468723 172.27.205.146 → 120.229.80.250 SSH 146 Server: Encrypted packet (len=92)
  274 9.501474867 120.229.80.250 → 172.27.205.146 TCP 60 1338 → 22 [ACK] Seq=5673 Ack=10393 Win=1023 Len=0
  275 9.517339061 120.229.80.250 → 172.27.205.146 SSH 154 Client: Encrypted packet (len=100)
  276 9.519090982 172.27.205.146 → 120.229.80.250 SSH 162 Server: Encrypted packet (len=108)
  277 9.572678672 172.27.205.146 → 120.229.80.250 SSH 146 Server: Encrypted packet (len=92)
  278 9.578722747 120.229.80.250 → 172.27.205.146 TCP 60 1338 → 22 [ACK] Seq=5773 Ack=10501 Win=1022 Len=0
  279 9.581852722 120.229.80.250 → 172.27.205.146 SSH 146 Client: Encrypted packet (len=92)
  280 9.583978157 172.27.205.146 → 120.229.80.250 SSH 154 Server: Encrypted packet (len=100)
  281 9.640233410 120.229.80.250 → 172.27.205.146 TCP 60 1338 → 22 [ACK] Seq=5865 Ack=10693 Win=1022 Len=0
  282 9.964713078 172.27.205.146 → 120.229.80.250 SSH 146 Server: Encrypted packet (len=92)
  283 10.027855766 120.229.80.250 → 172.27.205.146 TCP 60 1338 → 22 [ACK] Seq=5865 Ack=10785 Win=1021 Len=0
  284 10.028594418 120.229.80.250 → 172.27.205.146 SSH 146 Client: Encrypted packet (len=92)
  285 10.029318297 172.27.205.146 → 120.229.80.250 SSH 154 Server: Encrypted packet (len=100)
  286 10.084765994 172.27.205.146 → 120.229.80.250 SSH 146 Server: Encrypted packet (len=92)
  287 10.088737256 120.229.80.250 → 172.27.205.146 TCP 60 1338 → 22 [ACK] Seq=5957 Ack=10885 Win=1021 Len=0
  288 10.093852517 120.229.80.250 → 172.27.205.146 SSH 146 Client: Encrypted packet (len=92)
  289 10.096050699 172.27.205.146 → 120.229.80.250 SSH 154 Server: Encrypted packet (len=100)
  290 10.151232119 120.229.80.250 → 172.27.205.146 TCP 60 1338 → 22 [ACK] Seq=6049 Ack=11077 Win=1020 Len=0
  291 10.476219075 172.27.205.146 → 120.229.80.250 SSH 146 Server: Encrypted packet (len=92)
  292 10.539123110 120.229.80.250 → 172.27.205.146 TCP 60 1338 → 22 [ACK] Seq=6049 Ack=11169 Win=1025 Len=0
  293 10.539852722 120.229.80.250 → 172.27.205.146 SSH 154 Client: Encrypted packet (len=100)
  294 10.541642612 172.27.205.146 → 120.229.80.250 SSH 154 Server: Encrypted packet (len=100)
  295 10.596540874 172.27.205.146 → 120.229.80.250 SSH 146 Server: Encrypted packet (len=92)
  296 10.601234215 120.229.80.250 → 172.27.205.146 TCP 60 1338 → 22 [ACK] Seq=6149 Ack=11269 Win=1025 Len=0
  297 10.605614085 120.229.80.250 → 172.27.205.146 SSH 146 Client: Encrypted packet (len=92)
  298 10.607701728 172.27.205.146 → 120.229.80.250 SSH 162 Server: Encrypted packet (len=108)
  299 10.663486115 120.229.80.250 → 172.27.205.146 TCP 60 1338 → 22 [ACK] Seq=6241 Ack=11469 Win=1024 Len=0
  300 10.860639511 172.27.205.146 → 120.229.80.250 SSH 146 Server: Encrypted packet (len=92)
  301 10.902542689 ee:ff:ff:ff:ff:ff → Xensourc_1a:37:de ARP 42 Who has 172.27.205.146? Tell 172.27.207.253
  302 10.902554550 Xensourc_1a:37:de → ee:ff:ff:ff:ff:ff ARP 42 172.27.205.146 is at 00:16:3e:1a:37:de
  303 10.910987656 120.229.80.250 → 172.27.205.146 TCP 60 1338 → 22 [ACK] Seq=6241 Ack=11561 Win=1024 Len=0
  304 10.988454960 172.27.205.146 → 120.229.80.250 SSH 146 Server: Encrypted packet (len=92)
  305 11.049871738 120.229.80.250 → 172.27.205.146 TCP 60 1338 → 22 [ACK] Seq=6241 Ack=11653 Win=1024 Len=0
  306 11.050358165 120.229.80.250 → 172.27.205.146 SSH 146 Client: Encrypted packet (len=92)
  307 11.052175628 172.27.205.146 → 120.229.80.250 SSH 162 Server: Encrypted packet (len=108)
  308 11.108684842 172.27.205.146 → 120.229.80.250 SSH 146 Server: Encrypted packet (len=92)
  309 11.110986480 120.229.80.250 → 172.27.205.146 TCP 60 1338 → 22 [ACK] Seq=6333 Ack=11761 Win=1023 Len=0
  310 11.117866123 120.229.80.250 → 172.27.205.146 SSH 146 Client: Encrypted packet (len=92)
  311 11.119933399 172.27.205.146 → 120.229.80.250 SSH 154 Server: Encrypted packet (len=100)
  312 11.173118471 120.229.80.250 → 172.27.205.146 TCP 60 1338 → 22 [ACK] Seq=6425 Ack=11953 Win=1022 Len=0
  313 11.399242227 120.229.80.250 → 172.27.205.146 SSH 162 Client: Encrypted packet (len=108)
  314 11.401543487 172.27.205.146 → 120.229.80.250 SSH 186 Server: Encrypted packet (len=132)
  315 11.410745497 120.229.80.250 → 172.27.205.146 SSH 154 Client: Encrypted packet (len=100)
  316 11.412621464 120.229.80.250 → 172.27.205.146 SSH 154 Client: Encrypted packet (len=100)
  317 11.412661385 172.27.205.146 → 120.229.80.250 TCP 54 22 → 1338 [ACK] Seq=12085 Ack=6733 Win=5246 Len=0
  318 11.412696380 172.27.205.146 → 120.229.80.250 SSH 170 Server: Encrypted packet (len=116)
  319 11.414871281 172.27.205.146 → 120.229.80.250 SSH 178 Server: Encrypted packet (len=124)
  320 11.421615009 120.229.80.250 → 172.27.205.146 SSH 146 Client: Encrypted packet (len=92)
  321 11.423634336 120.229.80.250 → 172.27.205.146 SSH 146 Client: Encrypted packet (len=92)
  322 11.423724508 172.27.205.146 → 120.229.80.250 TCP 54 22 → 1338 [ACK] Seq=12325 Ack=6917 Win=5246 Len=0
  323 11.423863008 172.27.205.146 → 120.229.80.250 SSH 274 Server: Encrypted packet (len=220)
  324 11.432618721 120.229.80.250 → 172.27.205.146 SSH 146 Client: Encrypted packet (len=92)
  325 11.432716908 172.27.205.146 → 120.229.80.250 SSH 178 Server: Encrypted packet (len=124)
  326 11.440373660 120.229.80.250 → 172.27.205.146 SSH 146 Client: Encrypted packet (len=92)
  327 11.440458479 172.27.205.146 → 120.229.80.250 SSH 162 Server: Encrypted packet (len=108)
  328 11.440478530 120.229.80.250 → 172.27.205.146 TCP 60 1338 → 22 [ACK] Seq=7101 Ack=12669 Win=1025 Len=0
  329 11.441385065 120.229.80.250 → 172.27.205.146 SSH 146 Client: Encrypted packet (len=92)
  330 11.442469910 172.27.205.146 → 120.229.80.250 SSH 218 Server: Encrypted packet (len=164)
  331 11.450617610 120.229.80.250 → 172.27.205.146 TCP 60 1338 → 22 [ACK] Seq=7193 Ack=12941 Win=1024 Len=0
  332 11.451615008 120.229.80.250 → 172.27.205.146 SSH 162 Client: Encrypted packet (len=108)
  333 11.453924455 172.27.205.146 → 120.229.80.250 SSH 210 Server: Encrypted packet (len=156)
  334 11.456988422 120.229.80.250 → 172.27.205.146 SSH 154 Client: Encrypted packet (len=100)
  335 11.459168595 172.27.205.146 → 120.229.80.250 SSH 178 Server: Encrypted packet (len=124)
  336 11.464624787 120.229.80.250 → 172.27.205.146 SSH 146 Client: Encrypted packet (len=92)
  337 11.464867437 120.229.80.250 → 172.27.205.146 SSH 162 Client: Encrypted packet (len=108)
  338 11.464943344 172.27.205.146 → 120.229.80.250 TCP 54 22 → 1338 [ACK] Seq=13221 Ack=7601 Win=5246 Len=0
  339 11.466417587 172.27.205.146 → 120.229.80.250 SSH 322 Server: Encrypted packet (len=268)
  340 11.473616870 120.229.80.250 → 172.27.205.146 SSH 146 Client: Encrypted packet (len=92)
  341 11.475672856 172.27.205.146 → 120.229.80.250 SSH 186 Server: Encrypted packet (len=132)
  342 11.483873909 120.229.80.250 → 172.27.205.146 TCP 60 1338 → 22 [ACK] Seq=7693 Ack=13621 Win=1022 Len=0
  343 11.485118059 120.229.80.250 → 172.27.205.146 SSH 146 Client: Encrypted packet (len=92)
  344 11.487228558 172.27.205.146 → 120.229.80.250 SSH 170 Server: Encrypted packet (len=116)
  345 11.496134277 120.229.80.250 → 172.27.205.146 SSH 146 Client: Encrypted packet (len=92)
  346 11.498817546 172.27.205.146 → 120.229.80.250 SSH 178 Server: Encrypted packet (len=124)
  347 11.539042729 172.27.205.146 → 120.229.80.250 SSH 154 Server: Encrypted packet (len=100)
  348 11.545944688 20.189.173.16 → 172.27.205.146 TLSv1.3 531 Application Data
  349 11.546610923 172.27.205.146 → 20.189.173.16 TLSv1.3 90 Application Data
  350 11.546717404 172.27.205.146 → 20.189.173.16 TCP 66 60266 → 443 [FIN, ACK] Seq=3211 Ack=5201 Win=64128 Len=0 TSval=1393610471 TSecr=1608730157
  351 11.547249389 120.229.80.250 → 172.27.205.146 TCP 60 1338 → 22 [ACK] Seq=7877 Ack=13961 Win=1020 Len=0
  352 11.601126492 120.229.80.250 → 172.27.205.146 SSH 154 Client: Encrypted packet (len=100)
  353 11.603003627 172.27.205.146 → 120.229.80.250 SSH 162 Server: Encrypted packet (len=108)
  354 11.626690740 172.27.205.146 → 120.229.80.250 SSH 146 Server: Encrypted packet (len=92)
  355 11.634869554 120.229.80.250 → 172.27.205.146 TCP 60 1338 → 22 [ACK] Seq=7977 Ack=14161 Win=1025 Len=0
  356 11.635987636 120.229.80.250 → 172.27.205.146 SSH 146 Client: Encrypted packet (len=92)
  357 11.638053629 172.27.205.146 → 120.229.80.250 SSH 154 Server: Encrypted packet (len=100)
  358 11.697130727 120.229.80.250 → 172.27.205.146 TCP 60 1338 → 22 [ACK] Seq=8069 Ack=14261 Win=1025 Len=0
  359 11.711499829 20.189.173.16 → 172.27.205.146 TCP 66 443 → 60266 [ACK] Seq=5201 Ack=3212 Win=4194816 Len=0 TSval=1608730325 TSecr=1393610471
  360 11.882400306 172.27.205.146 → 120.229.80.250 SSH 146 Server: Encrypted packet (len=92)
  361 11.891625276 120.229.80.250 → 172.27.205.146 SSH 146 Client: Encrypted packet (len=92)
  362 11.893732994 172.27.205.146 → 120.229.80.250 SSH 162 Server: Encrypted packet (len=108)
  363 11.945258474 120.229.80.250 → 172.27.205.146 TCP 60 1338 → 22 [ACK] Seq=8161 Ack=14461 Win=1024 Len=0
  364 12.012510122 172.27.205.146 → 120.229.80.250 SSH 146 Server: Encrypted packet (len=92)
  365 12.068631546 120.229.80.250 → 172.27.205.146 TCP 60 1338 → 22 [ACK] Seq=8161 Ack=14553 Win=1024 Len=0
  366 12.074116611 120.229.80.250 → 172.27.205.146 SSH 146 Client: Encrypted packet (len=92)
  367 12.075846349 172.27.205.146 → 120.229.80.250 SSH 154 Server: Encrypted packet (len=100)
  368 12.131514549 120.229.80.250 → 172.27.205.146 TCP 60 1338 → 22 [ACK] Seq=8253 Ack=14653 Win=1023 Len=0
  369 12.132706745 172.27.205.146 → 120.229.80.250 SSH 146 Server: Encrypted packet (len=92)
  370 12.141882574 120.229.80.250 → 172.27.205.146 SSH 146 Client: Encrypted packet (len=92)
  371 12.143958577 172.27.205.146 → 120.229.80.250 SSH 154 Server: Encrypted packet (len=100)
  372 12.193498668 120.229.80.250 → 172.27.205.146 TCP 60 1338 → 22 [ACK] Seq=8345 Ack=14845 Win=1023 Len=0
  373 12.524499941 172.27.205.146 → 120.229.80.250 SSH 146 Server: Encrypted packet (len=92)
  374 12.576636950 120.229.80.250 → 172.27.205.146 TCP 60 1338 → 22 [ACK] Seq=8345 Ack=14937 Win=1022 Len=0
  375 12.592644767 120.229.80.250 → 172.27.205.146 SSH 146 Client: Encrypted packet (len=92)
  376 12.594443171 172.27.205.146 → 120.229.80.250 SSH 154 Server: Encrypted packet (len=100)
  377 12.644642817 172.27.205.146 → 120.229.80.250 SSH 146 Server: Encrypted packet (len=92)
  378 12.652766056 120.229.80.250 → 172.27.205.146 TCP 60 1338 → 22 [ACK] Seq=8437 Ack=15037 Win=1022 Len=0
  379 12.653896413 120.229.80.250 → 172.27.205.146 SSH 146 Client: Encrypted packet (len=92)
  380 12.655995435 172.27.205.146 → 120.229.80.250 SSH 154 Server: Encrypted packet (len=100)
  381 12.714512465 120.229.80.250 → 172.27.205.146 TCP 60 1338 → 22 [ACK] Seq=8529 Ack=15229 Win=1021 Len=0
  382 13.036445690 172.27.205.146 → 120.229.80.250 SSH 146 Server: Encrypted packet (len=92)
  383 13.084641239 120.229.80.250 → 172.27.205.146 TCP 60 1338 → 22 [ACK] Seq=8529 Ack=15321 Win=1021 Len=0
  384 13.087991082 172.27.205.146 → 100.100.2.136 DNS 92 Standard query 0xc172 A metrichub-cn-shenzhen.aliyun.com
  385 13.088048393 172.27.205.146 → 100.100.2.136 DNS 92 Standard query 0xdad3 AAAA metrichub-cn-shenzhen.aliyun.com
  386 13.088136448 100.100.2.136 → 172.27.205.146 DNS 108 Standard query response 0xc172 A metrichub-cn-shenzhen.aliyun.com A 100.100.21.100
  387 13.088163507 100.100.2.136 → 172.27.205.146 DNS 178 Standard query response 0xdad3 AAAA metrichub-cn-shenzhen.aliyun.com SOA hidden-master.aliyun.com
  388 13.088332333 172.27.205.146 → 100.100.21.100 TCP 74 52482 → 80 [SYN] Seq=0 Win=64240 Len=0 MSS=1460 SACK_PERM=1 TSval=2410525754 TSecr=0 WS=128
  389 13.094249972 100.100.21.100 → 172.27.205.146 TCP 66 80 → 52482 [SYN, ACK] Seq=0 Ack=1 Win=64240 Len=0 MSS=1440 SACK_PERM=1 WS=128
  390 13.094265879 172.27.205.146 → 100.100.21.100 TCP 54 52482 → 80 [ACK] Seq=1 Ack=1 Win=64256 Len=0
  391 13.094321584 172.27.205.146 → 100.100.21.100 TCP 4374 POST /agent/metrics/putLines HTTP/1.1  [TCP segment of a reassembled PDU]
  392 13.094327738 172.27.205.146 → 100.100.21.100 TCP 4374 52482 → 80 [ACK] Seq=4321 Ack=1 Win=64256 Len=4320 [TCP segment of a reassembled PDU]
